{
  "schema_version":"1.0.0","budget_id":"BUDGET-1","revision":1,"workspace_id":"11111111-1111-4111-8111-111111111111","process_id":"PROCESS-1","appointment_id":"APPOINTMENT-1",
  "items":[{"item_id":"ITEM-1","category":"PROFESSIONAL_HOURS","description":"Análise técnica sintética","quantity":"10.00","unit_amount":"150.00","total_amount":"1500.00"}],
  "effort_estimates":[{"estimate_id":"EFFORT-1","professional_id":"EXPERT-1","estimated_hours":"8.00","hourly_amount":"150.00","total_amount":"1200.00"}],
  "travel_estimates":[{"estimate_id":"TRAVEL-1","distance_km":"40.00","amount_per_km":"1.50","total_amount":"60.00","description":"Visita sintética"}],
  "third_party_estimates":[{"estimate_id":"THIRD-1","provider_description":"Laboratório sintético","amount":"500.00","currency":"BRL"}],
  "expenses":[{"expense_id":"EXPENSE-1","category":"EQUIPMENT","amount":"100.00","currency":"BRL","incurred_on":"2026-08-31","description":"Equipamento sintético"}],
  "proposals":[{"proposal_id":"PROPOSAL-1","revision":1,"amount":"2500.00","currency":"BRL","proposed_at":"2026-08-31T12:00:00+00:00","rationale":"Orçamento inicial"}],
  "proposal_revisions":[{"revision_id":"REVISION-1","proposal_id":"PROPOSAL-1","revision":1,"supersedes_revision_id":null,"reason":"Emissão inicial","revised_at":"2026-08-31T12:00:00+00:00"}],
  "court_approvals":[{"approval_id":"APPROVAL-1","court_decision_id":"DECISION-1","amount":"2200.00","currency":"BRL","decided_on":"2026-09-01"}],
  "payments":[{"payment_id":"PAYMENT-1","amount":"1000.00","currency":"BRL","received_on":"2026-09-02","reference":"Depósito judicial sintético"}],
  "status":"PARTIALLY_RECEIVED","outstanding":{"amount":"1200.00","currency":"BRL"}
}
